<?xml version="1.0" encoding="UTF-8"?>
<riassunti xmlns:xsi="http://www.w3.org/2001/XMLSchema-instance" xsi:noNamespaceSchemaLocation="riassunti.xsd"><riassunto condivisione="pubblico"><ID>1</ID><titolo>Questo è un riassunto di prova</titolo><emailStudente>pietro.nardelliz@gmail.com</emailStudente><data>2017-10-14</data><orario>16:39:44</orario><descrizione>Questa è la descrizione del riassunto, consiste nel dire ciò che si vuole dire prima di presentare il PDF sottostante.</descrizione><linkDocumento>uploads/1507991984.pdf</linkDocumento><visualizzazioni>0</visualizzazioni><tags><nomeTag>prova</nomeTag><nomeTag>riassunto</nomeTag></tags><preferiti/></riassunto><riassunto condivisione="pubblico"><ID>2</ID><titolo>Secondo riassunto di prova</titolo><emailStudente>pietro.nardelliz@gmail.com</emailStudente><data>2017-10-14</data><orario>16:41:12</orario><descrizione/><linkDocumento>uploads/1507992072.pdf</linkDocumento><visualizzazioni>0</visualizzazioni><tags><nomeTag>boarding pass</nomeTag></tags><preferiti/></riassunto><riassunto condivisione="pubblico"><ID>3</ID><titolo>Un altro riassunto di prova</titolo><emailStudente>pietro.nardelliz@gmail.com</emailStudente><data>2017-10-14</data><orario>16:51:45</orario><descrizione/><linkDocumento>uploads/1507992705.pdf</linkDocumento><visualizzazioni>0</visualizzazioni><tags><nomeTag>asdfaf</nomeTag></tags><preferiti/></riassunto><riassunto condivisione="privato"><ID>4</ID><titolo>Un altro ancora riassunto di prova</titolo><emailStudente>pietro.nardelliz@gmail.com</emailStudente><data>2017-10-14</data><orario>17:27:07</orario><descrizione>ciaociao</descrizione><linkDocumento>uploads/1507994827.pdf</linkDocumento><visualizzazioni>0</visualizzazioni><tags><nomeTag>ciao</nomeTag><nomeTag>prova</nomeTag></tags><preferiti/></riassunto></riassunti>
